{"$schema": "http://json-schema.org/draft-07/schema#", "title": "Agent9ja ground-truth facts (M004)", "type": "array", "items": {"properties": {"fact_id": {"pattern": "^[a-z]+_[A-Za-z0-9_]+$", "type": "string"}, "origin_id": {"pattern": "^[a-z]+_[A-Za-z0-9_]+$", "type": "string"}, "tags": {"items": {"type": "string"}, "type": "array"}, "value": {}}, "required": ["fact_id", "value"], "type": "object"}}